{
  "$schema": "https://json-schema.org/draft/2020-12/schema",
  "$id": "urn:agentj:design:p86:registry:1",
  "title": "registry proposed design",
  "type": "object",
  "additionalProperties": false,
  "properties": {
    "schema_version": {
      "const": 1
    },
    "host_id": {
      "type": "string",
      "pattern": "^[a-z0-9][a-z0-9.-]{0,79}$"
    },
    "revision": {
      "type": "integer",
      "minimum": 1
    },
    "generated_at": {
      "type": "string",
      "format": "date-time",
      "pattern": "^[0-9]{4}-[0-9]{2}-[0-9]{2}T[0-9]{2}:[0-9]{2}:[0-9]{2}(?:\\.[0-9]+)?(?:Z|[+-][0-9]{2}:[0-9]{2})$"
    },
    "entries": {
      "type": "array",
      "items": {
        "type": "object",
        "additionalProperties": false,
        "properties": {
          "id": {
            "type": "string",
            "pattern": "^[a-z0-9][a-z0-9.-]{0,79}$"
          },
          "kind": {
            "enum": [
              "skill",
              "cli",
              "mcp",
              "browser",
              "credential",
              "ceo"
            ]
          },
          "title": {
            "type": "object",
            "additionalProperties": false,
            "properties": {
              "zh": {
                "type": "string",
                "minLength": 1,
                "maxLength": 500
              },
              "en": {
                "type": "string",
                "minLength": 1,
                "maxLength": 500
              }
            },
            "required": [
              "zh",
              "en"
            ]
          },
          "source_ref": {
            "type": "string",
            "pattern": "^(?!/)(?!.*(?:^|/)\\.\\.(?:/|$))[A-Za-z0-9][A-Za-z0-9_./-]{0,200}$"
          },
          "scope": {
            "type": "array",
            "items": {
              "type": "string",
              "minLength": 1,
              "maxLength": 500
            },
            "minItems": 0,
            "maxItems": 20
          },
          "provides": {
            "type": "array",
            "items": {
              "type": "string",
              "pattern": "^[a-z0-9][a-z0-9.-]{0,79}$"
            },
            "minItems": 1,
            "maxItems": 20
          },
          "depends_on": {
            "type": "array",
            "items": {
              "type": "string",
              "pattern": "^[a-z0-9][a-z0-9.-]{0,79}$"
            },
            "minItems": 0,
            "maxItems": 20
          },
          "status": {
            "enum": [
              "discovered",
              "missing",
              "unverified",
              "ready",
              "stale",
              "unavailable",
              "conflict"
            ]
          },
          "credential_name": {
            "type": [
              "string",
              "null"
            ],
            "pattern": "^[A-Z][A-Z0-9_]{0,79}$"
          },
          "check": {
            "type": "object",
            "additionalProperties": false,
            "properties": {
              "status": {
                "enum": [
                  "ok",
                  "auth_required",
                  "not_found",
                  "permission_denied",
                  "offline",
                  "timeout",
                  "unsupported"
                ]
              },
              "adapter_id": {
                "type": "string",
                "pattern": "^[a-z0-9][a-z0-9.-]{0,79}$"
              },
              "last_verified_at": {
                "anyOf": [
                  {
                    "type": "string",
                    "format": "date-time",
                    "pattern": "^[0-9]{4}-[0-9]{2}-[0-9]{2}T[0-9]{2}:[0-9]{2}:[0-9]{2}(?:\\.[0-9]+)?(?:Z|[+-][0-9]{2}:[0-9]{2})$"
                  },
                  {
                    "type": "null"
                  }
                ]
              },
              "expires_at": {
                "anyOf": [
                  {
                    "type": "string",
                    "format": "date-time",
                    "pattern": "^[0-9]{4}-[0-9]{2}-[0-9]{2}T[0-9]{2}:[0-9]{2}:[0-9]{2}(?:\\.[0-9]+)?(?:Z|[+-][0-9]{2}:[0-9]{2})$"
                  },
                  {
                    "type": "null"
                  }
                ]
              },
              "source_digest": {
                "anyOf": [
                  {
                    "type": "string",
                    "pattern": "^[a-f0-9]{64}$"
                  },
                  {
                    "type": "null"
                  }
                ]
              }
            },
            "required": [
              "status",
              "adapter_id",
              "last_verified_at",
              "expires_at",
              "source_digest"
            ]
          }
        },
        "required": [
          "id",
          "kind",
          "title",
          "source_ref",
          "scope",
          "provides",
          "depends_on",
          "status",
          "credential_name",
          "check"
        ],
        "allOf": [
          {
            "if": {
              "properties": {
                "kind": {
                  "const": "credential"
                }
              }
            },
            "then": {
              "properties": {
                "credential_name": {
                  "type": "string"
                }
              }
            },
            "else": {
              "properties": {
                "credential_name": {
                  "type": "null"
                }
              }
            }
          },
          {
            "if": {
              "properties": {
                "status": {
                  "const": "ready"
                }
              }
            },
            "then": {
              "properties": {
                "check": {
                  "properties": {
                    "status": {
                      "const": "ok"
                    },
                    "last_verified_at": {
                      "type": "string",
                      "format": "date-time",
                      "pattern": "^[0-9]{4}-[0-9]{2}-[0-9]{2}T[0-9]{2}:[0-9]{2}:[0-9]{2}(?:\\.[0-9]+)?(?:Z|[+-][0-9]{2}:[0-9]{2})$"
                    },
                    "expires_at": {
                      "type": "string",
                      "format": "date-time",
                      "pattern": "^[0-9]{4}-[0-9]{2}-[0-9]{2}T[0-9]{2}:[0-9]{2}:[0-9]{2}(?:\\.[0-9]+)?(?:Z|[+-][0-9]{2}:[0-9]{2})$"
                    }
                  }
                }
              }
            }
          }
        ]
      },
      "minItems": 0,
      "maxItems": 1000
    }
  },
  "required": [
    "schema_version",
    "host_id",
    "revision",
    "generated_at",
    "entries"
  ]
}
